{
  "schema": "knowledge-hub.product.knowledgeos-v01-rc-research-preview-release-readiness-decision-gate.v1",
  "status": "ready",
  "generatedAt": "2026-05-30T15:18:43Z",
  "decision": "knowledgeos_v01_rc_research_preview_release_readiness_decision_gate_ready",
  "nextRecommendedTranche": "operator_release_package_handoff_or_branch_cleanup_decision",
  "inputs": {
    "positiveCompleteReviewReportRef": "eval/knowledgeos/reports/knowledgeos_v01_rc_positive_section_paragraph_quality_complete_review.v1.json",
    "productDefinitionDocRef": "docs/knowledge_os_definition.md",
    "releaseNotesDocRef": "docs/releases/knowledge-hub-v0.1-rc-research-preview.md"
  },
  "readinessDecision": {
    "researchPreviewDecision": "ready_for_controlled_research_preview_release",
    "publicDefaultDecision": "hold_public_default_promotion",
    "defaultSurfaceDecision": "do_not_enable_default_ask_or_default_mcp",
    "generalReleaseDecision": "not_ready_for_general_release",
    "strongestSupportedClaim": "section_paragraph_positive_slice_ready_with_conservative_no_answer_boundary",
    "nextGate": "operator_release_package_handoff_or_branch_cleanup_decision"
  },
  "counts": {
    "releaseReadinessDecisionRows": 1,
    "positiveCompleteReviewReadyRows": 1,
    "productDefinitionReadyRows": 1,
    "releaseNotesReadyRows": 1,
    "inputCaseRows": 50,
    "positiveSeedRows": 7,
    "positiveAnswerPassRows": 7,
    "positiveAnswerFailRows": 0,
    "provenancePassRows": 7,
    "provenanceFailRows": 0,
    "strictProvenanceSpanRows": 20,
    "sourceContentHashRows": 20,
    "charsLocatorRows": 20,
    "answerContractCitationProvenanceRows": 20,
    "heldExpectedNoAnswerRows": 17,
    "heldStructuredModalityRows": 34,
    "qualityPrMergedRows": 3,
    "ciCheckSuccessRows": 21,
    "releaseSmokePassedRows": 10,
    "publicHygieneIssueRows": 0,
    "positiveSectionParagraphQualityCompleteRows": 1,
    "researchPreviewReleaseReadyRows": 1,
    "researchPreviewReleaseHeldRows": 0,
    "publicDefaultPromotionReadyRows": 0,
    "publicDefaultPromotionHeldRows": 1,
    "generalRcReadyRows": 0,
    "corpusScalePositiveSliceProvenRows": 1,
    "corpusScaleClaimProvenRows": 0,
    "tableEquationFigureDefaultEvidenceRows": 0,
    "visualHintAnswerEvidenceRows": 0,
    "branchCleanupRecommendedRows": 3,
    "branchCleanupAppliedRows": 0,
    "blockedRows": 0,
    "candidateStoreWriteRows": 0,
    "sourceSpanCreatedRows": 0,
    "strictEvidenceRows": 0,
    "citationGradeEvidenceRows": 0,
    "runtimeEvidenceRows": 0,
    "parserExecutionRows": 0,
    "databaseMutationRows": 0,
    "indexMutationRows": 0,
    "reindexOrReembedRows": 0,
    "canonicalParsedArtifactWriteRows": 0,
    "vaultScanRows": 0,
    "externalDownloadRows": 0,
    "publicCliFlagRows": 0,
    "defaultOnRows": 0,
    "externalLlmCallRows": 0,
    "modelApiCallRows": 0,
    "judgeModelCallRows": 0,
    "pushRows": 0,
    "githubPrMutationRows": 0,
    "mergeRows": 0,
    "branchDeletionRows": 0,
    "releaseTagRows": 0,
    "packagePublishRows": 0,
    "rawGithubPayloadPersistedRows": 0,
    "defaultMcpToolRows": 0,
    "defaultKhubAskRouteRows": 0,
    "privatePathLeakRows": 0,
    "schemaViolationCount": 0
  },
  "gate": {
    "releaseReadinessDecisionReady": true,
    "positiveCompleteReviewReady": true,
    "productDefinitionReady": true,
    "releaseNotesReady": true,
    "researchPreviewReleaseAllowed": true,
    "publicDefaultPromotionAllowed": false,
    "generalRcReady": false,
    "semanticViolations": []
  },
  "checkRows": [
    {
      "checkId": "positive_section_paragraph_quality_complete_review",
      "status": "pass",
      "blockers": []
    },
    {
      "checkId": "product_definition",
      "status": "pass",
      "blockers": []
    },
    {
      "checkId": "release_notes_required_phrases",
      "status": "pass",
      "blockers": []
    },
    {
      "checkId": "release_notes_forbidden_phrases",
      "status": "pass",
      "blockers": []
    },
    {
      "checkId": "private_path_hygiene",
      "status": "pass",
      "blockers": []
    }
  ],
  "nextActionRows": [
    {
      "actionId": "operator_release_package_handoff",
      "status": "recommended_not_applied",
      "requiresExplicitApproval": true,
      "summary": "Prepare or review the Research Preview package handoff without enabling public/default surfaces."
    },
    {
      "actionId": "branch_cleanup_decision",
      "status": "recommended_not_applied",
      "requiresExplicitApproval": true,
      "summary": "Decide whether to clean up merged quality branches; do not delete branches in this gate."
    },
    {
      "actionId": "public_default_promotion",
      "status": "held",
      "requiresExplicitApproval": true,
      "summary": "Keep public/default `khub ask` and default MCP promotion held until corpus-scale quality evidence passes."
    }
  ],
  "warnings": [
    "research_preview_release_ready_does_not_mean_general_release_ready",
    "public_default_promotion_remains_held",
    "table_equation_figure_evidence_remains_outside_v01_default_promise",
    "visual_retrieval_hints_remain_candidate_discovery_only",
    "branch_cleanup_not_applied_in_this_tranche"
  ]
}
